Link,Cidade,Nome,Nota,Avaliação,Quantidade Avaliações,Informações,Preço
https://www.booking.com/hotel/br/recanto-kalan.pt-br.html?label=gen173nr-1FCAQoggJCDnNlYXJjaF9hcGnDum5hSC1YBGggiAEBmAEtuAEXyAEM2AEB6AEB-AEDiAIBqAIDuAKH24y_BsACAdICJGFkNjY0MDlkLTA1ODItNDhlZi04NDRhLTdkYzVmNDNjY2M5MtgCBeACAQ&aid=304142&ucfs=1&arphpl=1&checkin=2025-04-15&checkout=2025-04-17&dest_id=-625400&dest_type=city&group_adults=2&req_adults=2&no_rooms=1&group_children=0&req_children=0&hpos=1&hapos=1&sr_order=popularity&srpvid=d2b958e288a714a5&srepoch=1743079111&all_sr_blocks=1304860801_403339708_4_0_0&highlighted_blocks=1304860801_403339708_4_0_0&matching_block_id=1304860801_403339708_4_0_0&sr_pri_blocks=1304860801_403339708_4_0_0__74480&from=searchresults,Apiúna,Recanto Kalan,,,,"Com piscina ao ar livre aberta o ano todo e vista para a piscina, Recanto Kalan fica em Apiúna. Esta acomodação oferece piscina privativa, Wi-Fi grátis e estacionamento privativo grátis.

Esta casa de temporada com ar-condicionado possui 1 quarto, TV de tela plana, espaço para refeições e cozinha com geladeira e forno.

O Aeroporto de Aeroporto Internacional de Navegantes fica a 112 km de distância.

A distância na descrição da acomodação é calculada pelo © OpenStreetMap",R$745
https://www.booking.com/hotel/br/nostra-habitazione.pt-br.html?label=gen173nr-1FCAQoggJCJ3NlYXJjaF9ibHVtZW5hdSwgc2FudGEgY2F0YXJpbmEsIGJyYXNpbEgtWARoIIgBAZgBLbgBF8gBDNgBAegBAfgBA4gCAagCA7gC-aWLvwbAAgHSAiRiOGZiOTZjYy03YmNhLTQ5YjItODEyZC0yMjc1ODg5ZWE1NDfYAgXgAgE&aid=304142&ucfs=1&arphpl=1&checkin=2025-04-15&checkout=2025-04-17&dest_id=-626503&dest_type=city&group_adults=2&req_adults=2&no_rooms=1&group_children=0&req_children=0&hpos=1&hapos=1&sr_order=popularity&srpvid=c9c258e9902702ed&srepoch=1743079127&all_sr_blocks=1362776001_408576638_4_0_0&highlighted_blocks=1362776001_408576638_4_0_0&matching_block_id=1362776001_408576638_4_0_0&sr_pri_blocks=1362776001_408576638_4_0_0__86400&from=searchresults,Ascurra,Nostra Habitazione,,,,"Com vista para o jardim, Nostra Habitazione oferece acomodação em Ascurra. Rodoviária de Blumenau fica a 47 km de distância e Vila Germânica fica a 46 km. Esta acomodação oferece Wi-Fi grátis, estacionamento privativo grátis e acesso a uma varanda.

O chalé tem 1 quarto, cozinha completa e 4 banheiros. Você terá TV de tela plana à sua disposição.

Nostra Habitazione fica a 48 km de Teatro Carlos Gomes e a 49 km de Catedral São Paulo Apóstolo. O Aeroporto de Aeroporto Internacional de Navegantes fica a 95 km de distância.

A distância na descrição da acomodação é calculada pelo © OpenStreetMap",R$864
https://www.booking.com/hotel/br/sitio-som-das-aguas-benedito-novo.pt-br.html?label=gen173nr-1FCAQoggJCJ3NlYXJjaF9ibHVtZW5hdSwgc2FudGEgY2F0YXJpbmEsIGJyYXNpbEgtWARoIIgBAZgBLbgBF8gBDNgBAegBAfgBA4gCAagCA7gC-aWLvwbAAgHSAiRiOGZiOTZjYy03YmNhLTQ5YjItODEyZC0yMjc1ODg5ZWE1NDfYAgXgAgE&aid=304142&ucfs=1&arphpl=1&checkin=2025-04-15&checkout=2025-04-17&dest_id=-629191&dest_type=city&group_adults=2&req_adults=2&no_rooms=1&group_children=0&req_children=0&hpos=1&hapos=1&sr_order=popularity&srpvid=9f5f58f0eb870317&srepoch=1743079143&all_sr_blocks=1184944301_390858861_4_0_0&highlighted_blocks=1184944301_390858861_4_0_0&matching_block_id=1184944301_390858861_4_0_0&sr_pri_blocks=1184944301_390858861_4_0_0__119490&from=searchresults,Benedito Novo,Sítio Som das Águas,"9,4",Fantástico,10.0,"Você pode ter direito a um desconto Genius em Sítio Som das Águas. Para verificar se um desconto Genius está disponível para as datas selecionadas, faça login.

Os descontos Genius nesta acomodação estão sujeitos às datas da reserva, datas da estadia e às outras ofertas disponíveis.

Em Benedito Novo, na região de Santa Catarina, Sítio Som das Águas oferece varanda e vista para o rio. A acomodação fornece jardim e estacionamento privativo grátis. Vila Germânica fica a 49 km de distância.

A villa possui 5 quartos, 3 banheiros, roupa de cama, toalhas, TV de tela plana, espaço para refeições, cozinha completa e terraço com vista para a montanha.

O Aeroporto de Aeroporto Internacional de Navegantes fica a 99 km de distância.

A distância na descrição da acomodação é calculada pelo © OpenStreetMap",R$1.195
https://www.booking.com/hotel/br/sitio-nono-luiz.pt-br.html?label=gen173nr-1FCAQoggJCJ3NlYXJjaF9ibHVtZW5hdSwgc2FudGEgY2F0YXJpbmEsIGJyYXNpbEgtWARoIIgBAZgBLbgBF8gBDNgBAegBAfgBA4gCAagCA7gC-aWLvwbAAgHSAiRiOGZiOTZjYy03YmNhLTQ5YjItODEyZC0yMjc1ODg5ZWE1NDfYAgXgAgE&aid=304142&ucfs=1&arphpl=1&checkin=2025-04-15&checkout=2025-04-17&dest_id=-629191&dest_type=city&group_adults=2&req_adults=2&no_rooms=1&group_children=0&req_children=0&hpos=2&hapos=2&sr_order=popularity&srpvid=9f5f58f0eb870317&srepoch=1743079143&all_sr_blocks=1296206301_409685984_2_0_0&highlighted_blocks=1296206301_409685984_2_0_0&matching_block_id=1296206301_409685984_2_0_0&sr_pri_blocks=1296206301_409685984_2_0_0__72000&from=searchresults,Benedito Novo,Sítio Nono Luiz,,,,"Em Benedito Novo, na região de Santa Catarina, Sítio Nono Luiz oferece varanda e vista para o rio. Este hotel-fazenda tem jardim e estacionamento privativo grátis.

Este hotel-fazenda com ar-condicionado conta com 3 quartos, uma sala de estar, uma cozinha completa com geladeira e chaleira, além de 1 banheiro com bidê e chuveiro. O hotel-fazenda oferece toalhas e roupa de cama.

Se você quiser conhecer a região, é possível andar de bicicleta nos arredores.

O Aeroporto de Aeroporto Internacional de Navegantes fica a 104 km da acomodação.

A distância na descrição da acomodação é calculada pelo © OpenStreetMap",R$720
https://www.booking.com/hotel/br/recanto-alto-liberdade-benedito-novo7.pt-br.html?label=gen173nr-1FCAQoggJCJ3NlYXJjaF9ibHVtZW5hdSwgc2FudGEgY2F0YXJpbmEsIGJyYXNpbEgtWARoIIgBAZgBLbgBF8gBDNgBAegBAfgBA4gCAagCA7gC-aWLvwbAAgHSAiRiOGZiOTZjYy03YmNhLTQ5YjItODEyZC0yMjc1ODg5ZWE1NDfYAgXgAgE&aid=304142&ucfs=1&arphpl=1&checkin=2025-04-15&checkout=2025-04-17&dest_id=-629191&dest_type=city&group_adults=2&req_adults=2&no_rooms=1&group_children=0&req_children=0&hpos=3&hapos=3&sr_order=popularity&srpvid=9f5f58f0eb870317&srepoch=1743079143&all_sr_blocks=1147528605_387589129_8_0_0&highlighted_blocks=1147528605_387589129_8_0_0&matching_block_id=1147528605_387589129_8_0_0&sr_pri_blocks=1147528605_387589129_8_0_0__110000&from=searchresults,Benedito Novo,Recanto da Liberdade,"9,0",Fantástico,3.0,"Recanto da Liberdade fica em Benedito Novo. Rodoviária de Blumenau fica a 42 km de distância, Vila Germânica fica a 42 km e Teatro Carlos Gomes fica a 43 km. Esta acomodação oferece piscina privativa, Wi-Fi grátis e estacionamento privativo grátis.

Esta casa de temporada tem 3 quartos separados, uma cozinha completa e 2 banheiros. Você terá TV de tela plana à sua disposição.

Recanto da Liberdade fica a 44 km de Museu da Água e a 44 km de Catedral São Paulo Apóstolo. O Aeroporto de Aeroporto Internacional de Navegantes fica a 91 km de distância.

A distância na descrição da acomodação é calculada pelo © OpenStreetMap",R$1.100
https://www.booking.com/hotel/br/cabana-vale-da-liberdade.pt-br.html?label=gen173nr-1FCAQoggJCJ3NlYXJjaF9ibHVtZW5hdSwgc2FudGEgY2F0YXJpbmEsIGJyYXNpbEgtWARoIIgBAZgBLbgBF8gBDNgBAegBAfgBA4gCAagCA7gC-aWLvwbAAgHSAiRiOGZiOTZjYy03YmNhLTQ5YjItODEyZC0yMjc1ODg5ZWE1NDfYAgXgAgE&aid=304142&ucfs=1&arphpl=1&checkin=2025-04-15&checkout=2025-04-17&dest_id=-629191&dest_type=city&group_adults=2&req_adults=2&no_rooms=1&group_children=0&req_children=0&hpos=4&hapos=4&sr_order=popularity&srpvid=9f5f58f0eb870317&srepoch=1743079143&all_sr_blocks=1259177401_398498343_2_0_0&highlighted_blocks=1259177401_398498343_2_0_0&matching_block_id=1259177401_398498343_2_0_0&sr_pri_blocks=1259177401_398498343_2_0_0__40366&from=searchresults,Benedito Novo,Cabana Vale da Liberdade,,,,"Em Benedito Novo, Cabana Vale da Liberdade conta com acomodação com varanda e Wi-Fi grátis. Esta casa de temporada tem jardim e estacionamento privativo grátis.

A casa de temporada oferece 2 quartos, uma TV de tela plana e uma cozinha completa com geladeira, forno, máquina de lavar roupa, micro-ondas e cooktop. A casa de temporada oferece toalhas e roupa de cama.

Um parquinho infantil está disponível na própria acomodação. Você pode fazer trilhas nas proximidades de Cabana Vale da Liberdade.

A distância na descrição da acomodação é calculada pelo © OpenStreetMap",R$404
https://www.booking.com/hotel/br/sitio-do-alemao-benedito-novo.pt-br.html?label=gen173nr-1FCAQoggJCJ3NlYXJjaF9ibHVtZW5hdSwgc2FudGEgY2F0YXJpbmEsIGJyYXNpbEgtWARoIIgBAZgBLbgBF8gBDNgBAegBAfgBA4gCAagCA7gC-aWLvwbAAgHSAiRiOGZiOTZjYy03YmNhLTQ5YjItODEyZC0yMjc1ODg5ZWE1NDfYAgXgAgE&aid=304142&ucfs=1&arphpl=1&checkin=2025-04-15&checkout=2025-04-17&dest_id=-629191&dest_type=city&group_adults=2&req_adults=2&no_rooms=1&group_children=0&req_children=0&hpos=5&hapos=5&sr_order=popularity&srpvid=9f5f58f0eb870317&srepoch=1743079143&all_sr_blocks=1102391201_383031775_2_0_0&highlighted_blocks=1102391201_383031775_2_0_0&matching_block_id=1102391201_383031775_2_0_0&sr_pri_blocks=1102391201_383031775_2_0_0__69300&from=searchresults,Benedito Novo,Sitio do Alemão,"9,5",,2.0,"Em Benedito Novo, Sitio do Alemão conta com acomodação com vista para o jardim, Wi-Fi grátis e estacionamento privativo grátis. Rodoviária de Blumenau fica a apenas 45 km de distância. Este chalé fica a 46 km de Museu da Água e a 46 km de Catedral São Paulo Apóstolo.

O chalé tem varanda, 1 quarto, sala de estar e cozinha bem equipada. Você terá à sua disposição TV de tela plana.

Sitio do Alemão fica a 44 km de Vila Germânica e a 46 km de Teatro Carlos Gomes. O Aeroporto de Aeroporto Internacional de Navegantes fica a 93 km da acomodação.

A distância na descrição da acomodação é calculada pelo © OpenStreetMap",R$693
https://www.booking.com/hotel/br/gloria-blumenau.pt-br.html?label=gen173nr-1FCAQoggJCJ3NlYXJjaF9ibHVtZW5hdSwgc2FudGEgY2F0YXJpbmEsIGJyYXNpbEgtWARoIIgBAZgBLbgBF8gBDNgBAegBAfgBA4gCAagCA7gC-aWLvwbAAgHSAiRiOGZiOTZjYy03YmNhLTQ5YjItODEyZC0yMjc1ODg5ZWE1NDfYAgXgAgE&aid=304142&ucfs=1&arphpl=1&checkin=2025-04-15&checkout=2025-04-17&dest_id=-629420&dest_type=city&group_adults=2&req_adults=2&no_rooms=1&group_children=0&req_children=0&hpos=1&hapos=1&sr_order=popularity&srpvid=e26e64f573490fcb&srepoch=1743085354&all_sr_blocks=55037104_408199339_0_1_0_538901&highlighted_blocks=55037104_408199339_0_1_0_538901&matching_block_id=55037104_408199339_0_1_0_538901&sr_pri_blocks=55037104_408199339_0_1_0_538901_52992&from=searchresults,Blumenau,Hotel Glória Blumenau,"9,4",Fantástico,6.476,"Você pode ter direito a um desconto Genius em Hotel Glória Blumenau. Para verificar se um desconto Genius está disponível para as datas selecionadas, faça login.

Os descontos Genius nesta acomodação estão sujeitos às datas da reserva, datas da estadia e às outras ofertas disponíveis.

O Glória está situado a apenas 200 m do Neumarkt, um shopping de Blumenau, e do Teatro Carlos Gomes. Dispõe de Wi-Fi gratuito e buffet de café-da-manhã diário no restaurante

Todos os quartos do hotel contam com ar-condicionado, TV a cabo, frigobar e banheiro privativo. Para a sua comodidade, serviços de lavanderia podem ser providenciados.

O Hotel Glória Blumenau fica a 1 km do centro de Blumenau e a 3 km do bairro Vila Germânica. Além disso, também está situado a 55 km do Aeroporto Internacional dos Navegantes. Há estacionamento gratuito à sua disposição.

Casais particularmente gostam da localização — eles deram nota 9,7 para viagem a dois.

A distância na descrição da acomodação é calculada pelo © OpenStreetMap",R$530
https://www.booking.com/hotel/br/ibis-budget-blumenau.pt-br.html?label=gen173nr-1FCAQoggJCJ3NlYXJjaF9ibHVtZW5hdSwgc2FudGEgY2F0YXJpbmEsIGJyYXNpbEgtWARoIIgBAZgBLbgBF8gBDNgBAegBAfgBA4gCAagCA7gC-aWLvwbAAgHSAiRiOGZiOTZjYy03YmNhLTQ5YjItODEyZC0yMjc1ODg5ZWE1NDfYAgXgAgE&aid=304142&ucfs=1&arphpl=1&checkin=2025-04-15&checkout=2025-04-17&dest_id=-629420&dest_type=city&group_adults=2&req_adults=2&no_rooms=1&group_children=0&req_children=0&hpos=2&hapos=2&sr_order=popularity&srpvid=e26e64f573490fcb&srepoch=1743085354&all_sr_blocks=224225105_377053549_2_1_0&highlighted_blocks=224225105_377053549_2_1_0&matching_block_id=224225105_377053549_2_1_0&sr_pri_blocks=224225105_377053549_2_1_0__60200&from=searchresults,Blumenau,ibis budget Blumenau,"8,3",Muito bom,2.643,"Com uma localização ideal a apenas 2 km do Parque Vila Germânica, onde se realiza a Oktoberfest de Blumenau, o Ibis Budget Blumenau oferece Wi-Fi gratuito em todas as áreas e um estacionamento privativo.

Com comodidades modernas e práticas, todos os quartos dispõem de ar-condicionado, TV de tela plana a cabo, mesa de trabalho e banheiro privativo com chuveiro. 

Você pode relaxar no bar da casa.

Além disso, a recepção está disponível 24 horas.

Você ainda pode desfrutar de diversas opções de entretenimento e de compras a uma curta caminhada. O Teatro Carlos Gomes fica a apenas 500 metros e o Neumarkt Shopping fica a 1,2 km. Já o aeroporto mais próximo, o Aeroporto Internacional de Navegantes - Ministro Victor Konder, fica a 42 km.

Casais particularmente gostam da localização — eles deram nota 9,2 para viagem a dois.

A distância na descrição da acomodação é calculada pelo © OpenStreetMap",R$602
https://www.booking.com/hotel/br/quality-blumenau.pt-br.html?label=gen173nr-1FCAQoggJCJ3NlYXJjaF9ibHVtZW5hdSwgc2FudGEgY2F0YXJpbmEsIGJyYXNpbEgtWARoIIgBAZgBLbgBF8gBDNgBAegBAfgBA4gCAagCA7gC-aWLvwbAAgHSAiRiOGZiOTZjYy03YmNhLTQ5YjItODEyZC0yMjc1ODg5ZWE1NDfYAgXgAgE&aid=304142&ucfs=1&arphpl=1&checkin=2025-04-15&checkout=2025-04-17&dest_id=-629420&dest_type=city&group_adults=2&req_adults=2&no_rooms=1&group_children=0&req_children=0&hpos=3&hapos=3&sr_order=popularity&srpvid=e26e64f573490fcb&srepoch=1743085354&all_sr_blocks=347411202_117386565_0_1_0&highlighted_blocks=347411202_117386565_0_1_0&matching_block_id=347411202_117386565_0_1_0&sr_pri_blocks=347411202_117386565_0_1_0__92028&from=searchresults,Blumenau,Quality Hotel Blumenau,"9,2",Fantástico,1.839,"Quality Hotel Blumenau fornece acomodação com piscina ao ar livre, estacionamento privativo grátis, academia e jardim em Blumenau. Rodoviária de Blumenau fica a 6,4 km de distância. As comodidades desta acomodação incluem restaurante, espaço kids e serviço de quarto, além de Wi-Fi grátis. O hotel oferece sauna e uma recepção 24 horas.

Neste hotel, os quartos incluem mesa de trabalho. Completos com banheiro privativo com chuveiro e produtos de banho de cortesia, os quartos deste hotel contam com TV de tela plana e ar-condicionado, e quartos selecionados contam com terraço. Neste hotel, cada quarto inclui roupa de cama e toalhas.

Em Quality Hotel Blumenau, você pode aproveitar um café da manhã em estilo buffet ou continental.

Quality Hotel Blumenau conta com parquinho infantil. Neste hotel 4 estrelas, você pode jogar bilhar e tênis de mesa.

Catedral São Paulo Apóstolo fica a 3,7 km de Quality Hotel Blumenau. O Aeroporto de Aeroporto Internacional de Navegantes fica a 54 km de distância.

Casais particularmente gostam da localização — eles deram nota 8,9 para viagem a dois.

A distância na descrição da acomodação é calculada pelo © OpenStreetMap",R$920
https://www.booking.com/hotel/br/next-blumenau.pt-br.html?label=gen173nr-1FCAQoggJCJ3NlYXJjaF9ibHVtZW5hdSwgc2FudGEgY2F0YXJpbmEsIGJyYXNpbEgtWARoIIgBAZgBLbgBF8gBDNgBAegBAfgBA4gCAagCA7gC-aWLvwbAAgHSAiRiOGZiOTZjYy03YmNhLTQ5YjItODEyZC0yMjc1ODg5ZWE1NDfYAgXgAgE&aid=304142&ucfs=1&arphpl=1&checkin=2025-04-15&checkout=2025-04-17&dest_id=-629420&dest_type=city&group_adults=2&req_adults=2&no_rooms=1&group_children=0&req_children=0&hpos=4&hapos=4&sr_order=popularity&srpvid=e26e64f573490fcb&srepoch=1743085354&all_sr_blocks=899483801_382294301_2_1_0&highlighted_blocks=899483801_382294301_2_1_0&matching_block_id=899483801_382294301_2_1_0&sr_pri_blocks=899483801_382294301_2_1_0__42200&from=searchresults,Blumenau,Blumenau Tower by Castelo Itaipava,"6,4",,3.48,"Você pode ter direito a um desconto Genius em Blumenau Tower by Castelo Itaipava. Para verificar se um desconto Genius está disponível para as datas selecionadas, faça login.

Os descontos Genius nesta acomodação estão sujeitos às datas da reserva, datas da estadia e às outras ofertas disponíveis.

Blumenau Tower by Castelo Itaipava está em Blumenau, a 4,2 km de Rodoviária de Blumenau e a 2,5 km de Museu da Água. Este hotel 3 estrelas tem quartos com ar-condicionado, banheiro privativo e Wi-Fi grátis. O hotel tem quartos para famílias.

As unidades neste hotel contam com TV e produtos de banho de cortesia.

Blumenau Tower by Castelo Itaipava oferece um café da manhã em estilo buffet ou continental.

A equipe da recepção 24 horas fala inglês e português.

Há vários pontos de interesse famosos perto de Blumenau Tower by Castelo Itaipava, incluindo Teatro Carlos Gomes, Catedral São Paulo Apóstolo e Castelo da Havan. O Aeroporto de Aeroporto Internacional de Navegantes fica a 52 km da acomodação.

Casais particularmente gostam da localização — eles deram nota 8,6 para viagem a dois.

A distância na descrição da acomodação é calculada pelo © OpenStreetMap",R$422
https://www.booking.com/hotel/br/plaza-blumenau.pt-br.html?label=gen173nr-1FCAQoggJCJ3NlYXJjaF9ibHVtZW5hdSwgc2FudGEgY2F0YXJpbmEsIGJyYXNpbEgtWARoIIgBAZgBLbgBF8gBDNgBAegBAfgBA4gCAagCA7gC-aWLvwbAAgHSAiRiOGZiOTZjYy03YmNhLTQ5YjItODEyZC0yMjc1ODg5ZWE1NDfYAgXgAgE&aid=304142&ucfs=1&arphpl=1&checkin=2025-04-15&checkout=2025-04-17&dest_id=-629420&dest_type=city&group_adults=2&req_adults=2&no_rooms=1&group_children=0&req_children=0&hpos=5&hapos=5&sr_order=popularity&srpvid=e26e64f573490fcb&srepoch=1743085354&all_sr_blocks=1593512_237339314_0_2_0&highlighted_blocks=1593512_237339314_0_2_0&matching_block_id=1593512_237339314_0_2_0&sr_pri_blocks=1593512_237339314_0_2_0__62992&from=searchresults,Blumenau,Plaza Blumenau Hotel,"8,6",Fabuloso,1.519,"Você pode ter direito a um desconto Genius em Plaza Blumenau Hotel. Para verificar se um desconto Genius está disponível para as datas selecionadas, faça login.

Os descontos Genius nesta acomodação estão sujeitos às datas da reserva, datas da estadia e às outras ofertas disponíveis.

Quartos, com ar-condicionado e internet gratuita esperam por você no Plaza Blumenau Hotel, um hotel acolhedor localizado no centro da cidade de Blumenau. O Museu da Cerveja fica a 800 m de distância. O Wi-Fi é gratuito em todas as áreas.

Você poderá desfrutar da localização privilegiada do hotel e caminhas pela animada Rua 15 de Novembro e contemplar a arquitetura alemã dos prédios típicos.

Caso prefira descansar no hotel, você poderá relaxar em uma espreguiçadeira na área da piscina ao ar livre enquanto apreciar uma bebida, ou poderá malhar na academia, no local.

Um restaurante e um bar também estão disponíveis no Plaza Blumenau, oferecendo um ambiente acolhedor e pratos internacionais.

O centro de eventos Vila Germânica fica a 4,5 km de distância. Já o Aeroporto Internacional de Navegantes fica a 55 km de distância.

Casais particularmente gostam da localização — eles deram nota 9,5 para viagem a dois.

A distância na descrição da acomodação é calculada pelo © OpenStreetMap",R$630
https://www.booking.com/hotel/br/slaveiro-blumenau.pt-br.html?label=gen173nr-1FCAQoggJCJ3NlYXJjaF9ibHVtZW5hdSwgc2FudGEgY2F0YXJpbmEsIGJyYXNpbEgtWARoIIgBAZgBLbgBF8gBDNgBAegBAfgBA4gCAagCA7gC-aWLvwbAAgHSAiRiOGZiOTZjYy03YmNhLTQ5YjItODEyZC0yMjc1ODg5ZWE1NDfYAgXgAgE&aid=304142&ucfs=1&arphpl=1&checkin=2025-04-15&checkout=2025-04-17&dest_id=-629420&dest_type=city&group_adults=2&req_adults=2&no_rooms=1&group_children=0&req_children=0&hpos=6&hapos=6&sr_order=popularity&srpvid=e26e64f573490fcb&srepoch=1743085354&all_sr_blocks=55108411_395975342_2_1_0&highlighted_blocks=55108411_395975342_2_1_0&matching_block_id=55108411_395975342_2_1_0&sr_pri_blocks=55108411_395975342_2_1_0__77662&from=searchresults,Blumenau,Slaviero Blumenau,"9,0",Fantástico,1.386,"Você pode ter direito a um desconto Genius em Slaviero Blumenau. Para verificar se um desconto Genius está disponível para as datas selecionadas, faça login.

Os descontos Genius nesta acomodação estão sujeitos às datas da reserva, datas da estadia e às outras ofertas disponíveis.

Centralmente localizado em Blumenau, o Slaviero Blumenau oferece acomodações práticas, com WiFi gratuito. Para sua comodidade, a recepção está aberta 24 horas.

Os quartos incluem ar-condicionado, aquecimento, área de estar, TV a cabo, telefone e banheiro privativo.

Além disso, a propriedade serve um buffet de café da manhã com itens variados. Você pode solicitar serviço de quarto na acomodação ou desfrutar da refeição na área de jantar, assim como utilizar o estacionamento no local.

O hotel fica a 55 km do Aeroporto de Navegantes e a 6 km da estação rodoviária de Blumenau. O Teatro Carlos Gomes está situado a 750 metros, e a Vila Germânica, a 3 km de distância.

Casais particularmente gostam da localização — eles deram nota 9,4 para viagem a dois.

A distância na descrição da acomodação é calculada pelo © OpenStreetMap",R$777
https://www.booking.com/hotel/br/ibis-blumenau.pt-br.html?label=gen173nr-1FCAQoggJCJ3NlYXJjaF9ibHVtZW5hdSwgc2FudGEgY2F0YXJpbmEsIGJyYXNpbEgtWARoIIgBAZgBLbgBF8gBDNgBAegBAfgBA4gCAagCA7gC-aWLvwbAAgHSAiRiOGZiOTZjYy03YmNhLTQ5YjItODEyZC0yMjc1ODg5ZWE1NDfYAgXgAgE&aid=304142&ucfs=1&arphpl=1&checkin=2025-04-15&checkout=2025-04-17&dest_id=-629420&dest_type=city&group_adults=2&req_adults=2&no_rooms=1&group_children=0&req_children=0&hpos=7&hapos=7&sr_order=popularity&srpvid=e26e64f573490fcb&srepoch=1743085354&all_sr_blocks=178907501_377053768_2_1_0&highlighted_blocks=178907501_377053768_2_1_0&matching_block_id=178907501_377053768_2_1_0&sr_pri_blocks=178907501_377053768_2_1_0__76200&from=searchresults,Blumenau,ibis Blumenau,"8,6",Fabuloso,1.08,"Ibis Blumenau conta com acomodação com jardim, estacionamento privativo, lounge compartilhado e restaurante em Blumenau. Rodoviária de Blumenau fica a 4,3 km de distância. Com bar, este hotel 3 estrelas tem quartos com ar-condicionado, Wi-Fi grátis e banheiro privativo. A acomodação fornece espaço kids e uma recepção 24 horas.

Um café da manhã com opções em estilo buffet e continental está disponível em ibis Blumenau.

Catedral São Paulo Apóstolo fica a 3 minutos a pé de ibis Blumenau. O Aeroporto de Aeroporto Internacional de Navegantes fica a 52 km da acomodação.

Casais particularmente gostam da localização — eles deram nota 9,6 para viagem a dois.

A distância na descrição da acomodação é calculada pelo © OpenStreetMap",R$762
https://www.booking.com/hotel/br/himmelblau-palace.pt-br.html?label=gen173nr-1FCAQoggJCJ3NlYXJjaF9ibHVtZW5hdSwgc2FudGEgY2F0YXJpbmEsIGJyYXNpbEgtWARoIIgBAZgBLbgBF8gBDNgBAegBAfgBA4gCAagCA7gC-aWLvwbAAgHSAiRiOGZiOTZjYy03YmNhLTQ5YjItODEyZC0yMjc1ODg5ZWE1NDfYAgXgAgE&aid=304142&ucfs=1&arphpl=1&checkin=2025-04-15&checkout=2025-04-17&dest_id=-629420&dest_type=city&group_adults=2&req_adults=2&no_rooms=1&group_children=0&req_children=0&hpos=8&hapos=8&sr_order=popularity&srpvid=e26e64f573490fcb&srepoch=1743085354&all_sr_blocks=39095701_93436465_0_9_0&highlighted_blocks=39095701_93436465_0_9_0&matching_block_id=39095701_93436465_0_9_0&sr_pri_blocks=39095701_93436465_0_9_0__72600&from=searchresults,Blumenau,Hotel Himmelblau,"8,6",Fabuloso,1.249,"Você pode ter direito a um desconto Genius em Hotel Himmelblau. Para verificar se um desconto Genius está disponível para as datas selecionadas, faça login.

Os descontos Genius nesta acomodação estão sujeitos às datas da reserva, datas da estadia e às outras ofertas disponíveis.

Localizado no centro de Blumenau, o Himmelblau Palace oferece acomodações com WiFi gratuito. O hotel conta com piscina ao ar livre, restaurante e business center.

Os quartos do Hotel Himmelblau dispõem de banheiro privativo, ar-condicionado, TV a cabo e frigobar. Para sua comodidade, a propriedade conta com serviço de quarto.

O hotel está situado a 100 metros da Avenida 15 de Novembro e a 2 km do famoso Parque Vila Germânica. Além disso, o Aeroporto de Navegantes fica a 42 km da propriedade.

Casais particularmente gostam da localização — eles deram nota 9,4 para viagem a dois.

A distância na descrição da acomodação é calculada pelo © OpenStreetMap",R$726
